{"schema":"gcd.trace-batch/1","runId":"01J00000000000000000000000","batch":0,"firstSeq":1,"lastSeq":24,"droppedTotal":0,"strings":{"0":"a","1":"b","2":"ref"},"events":[[1,"SB",0],[2,"A",0,"0"],[3,"RC",0,0,null],[4,"RS",0,0,"0"],[5,"SE",0],[6,"SB",1],[7,"A",1,"1"],[8,"RC",1,1,null],[9,"RS",1,1,"1"],[10,"SE",1],[11,"SB",2],[12,"FW",2,2,"0","1",null],[13,"SE",2],[14,"SB",3],[15,"RC",3,0,"0"],[16,"SE",3],[17,"SB",4],[18,"RC",4,1,"1"],[19,"SE",4],[20,"SB",5],[21,"GB",5,1],[22,"SF",5,"0"],[23,"SF",5,"1"],[24,"GE",5,1,2,0]]}
